text,emotion
"I, also, wound up face down on my floor for a good 5-10 minutes after the Saints won it in OT.",lonely
Autistic space AIDS,anxious
I’m sorry about your friend.,tired
"I repent. I repent. Oh someone someone, I do repent.",tired
"I wish there was a bridge there, because then that would have been worth it. This river is the biggest pain in my zone!",excited
"oh i wish i didn't read that, someone",tired
felt that so hard too,sad
Understood - PM was all gears and no downtime. Last thing I would want is another bloody job like that. Cheers,excited
And the super rich are still miserable,sad
"i had all of those. checked myself with a GP and found out i had low iron, migraines and needed to visit the therapist re my anxiety.",anxious
Yea idk what to tell ya man sorry. Not sure why it’s doing that,grateful
Someone with erectile dysfunction already can't (conventionally) orgasm. What the fuck are you talking about?,lonely
I got that feeling as well. Hoping he retires a Jet. We are the one org that embraced him. He was coaching sam every step.,lonely
"I'm sorry Mom, your child has autism, or this is a lie.",tired
"that’s actually sad, feel bad for him :/",sad
"I actually see this one a lot. ""Allergy: fire ants."" Me too, bro. Ants will fuck you up.",angry
Whoops!! I totally didn’t realize ‍♀️,lonely
I think there’s something to the concept that overindulgence in technology contributes to a lack of physical and emotional bonding these days.,happy
I can see the place where I grew up on here :),excited
"okay for real, i saw this when the game ended. i died. i fucking died laughing. -sent from my HeavenPhone (TM)",happy
I enjoy living the lie. I do it everyday,sad
It’s kinda sad that this made me lol.,happy
EGG ROLLS. That's why your progress isn't good.,frustrated
"I’ve been saying this since the beginning, it would help so much in a intense gunfight",tired
Not to mention that the full video is part of the kids PR campaign according to someone idiot,sad
What a sad post. I cannot believe people actually follow their advice.,sad
What. The. Fresh. Fuck.,excited
Lmao I’m so sorry but yet intrigued as to how it contributed to your breakup?,tired
Etiquette Try to keep a positive attitude.,grateful
For the record I don’t necessarily want him either. I just think he’s a compelling person.,frustrated
I guess its the 9th largest city in the country but it it weird to group them together,angry
I don’t recall EVER being so excited about next year!,excited
There's a guy that died after he let a horse do that. He'd probably have survived if he sought medical attention sooner.,sad
"No she never told me her name, and I unfortunately never asked for that or her number.",tired
"someone, too. someone is very guilty of this.",calm
"Yeah, that was all you though. Goodnight and happy new year",grateful
England is all about driver safety. Competence...well....,grateful
"""UGH FEMINISM!!! SURELY THATS THE REASON I CANT GET LAID!!!"" see you in hell",sad
I would have laughed it off and walked away. Last thing I would do is ask the internet if I was right or wrong.,frustrated
Thanks. Those are great suggestions.,grateful
Hi let’s not compare basketball to the man speaking out against a dictator and fearing for his life because of it thank you,grateful
> Also why I watched the old guy getting stabbed with screwdrivers till he stopped moving! Dnepropetrovsk maniacs? (3 guys 1 hammer),tired
yea I was gonna say that looks pretty good to me,excited
I love making fun of social outcasts.,happy
Good sense of humor!,grateful
Unite us. Unite the clans.,calm
That was painful to read.,sad
Its better to just abuse us in overt ways since we tend to be doormats,angry
I can't believe he got it while getting man-handled by two players!!,sad
Both but which one being the most used isn't really important.,frustrated
OMG the bra hanging out of the back of that dress is so cringe.,lonely
“I thought I was suppose to love 2018 wtf”,happy
"You know what you’re right, not with risking my CC info. Good thing I was too lazy to do it right away.",calm
That feels nice.,happy
On my way! Thanks!,grateful
"I hope you’re trolling. Anyway, have a good night.",lonely
Of course he can't,calm
EWWW yes. This makes me shudder. All wet and gross.,anxious
Daddy issues someone,lonely
> I'm not exactly surprised he was convicted when he didn't bother to defend himself He was able to instruct his lawyers.,calm
"Dammit, someone! You're only hurting hardworking doggos with this shutdown!",sad
Isn’t /politicalhumor a sub that barely has any real activity though...?,calm
I didn’t like that blue & yellow until you said someone.,frustrated
"Oh they can make numbers up too , good idea. Astroturfing starwars, this is the worst timeline.",sad
"For an alternate anecdote, I quit playing because of the forced role QM changes, so there's that.",frustrated
"it's embarrassing you think that pact is an example of them getting on well together, especially considering the millions of deaths that followed",lonely
I watched the whole thing. I miss that style of cartoon. Simultaneously silly and understated.,sad
Four onions grew into one. I have a pic from when I halved it. I'll post it when I'm not working,calm
"As much as I’d love someone to be gone, i know they never would",happy
Get your feet off the table...,angry
"I don’t know, I think we all just blunder through.",lonely
And then get frustrated when they realize the internet isn't censored and then call for censorship.,angry
"As a someone, I would like to extend an apology to anyone freezing in the polar vortex.",tired
I think he's said before he'd never go on question time,calm
They said Texas! #Woooooo TEXAS,excited
They wouldn't be entirely wrong...I know I'm certainly fatigued with the way Doctor Who has been going for a while now.,frustrated
"Boy, are you going to cake yourself when you find out what french kissing is",lonely
Srs that shade range is abysmal smh,lonely
"He knows she's winning the PR war, so he's lashing out like the angry toddler he is.",excited
"No, sadly it was from a different person, thankfully not the original poster though.",sad
tbh i would've guiltied but atleast they didnt lose an important TP,tired
I genuinely just for once want to be in a situation where everyone applauds. That’s my New Years resolution.,excited
that is the most obnoxious chant ever the chiefs do it too,sad
And I thought they smelled bad on the outside!,angry
"are you tagging them as your #WCW? if not, you should start",calm
"We did it, finally?! Idk weird timing.",happy
Take a seat young ragewalker.,excited
This sounds very familiar...,happy
This is too cute :),grateful
"It's ironic that those who most strongly embrace TSSC and other churches are so often utterly lacking in any level of true ""faith.""",lonely
"Oh, I definitely got muted, too.",tired
We all are afraid of losing our jobs here or being blackballed all the same.,anxious
"It's just a name that boils down to semantics. Not derogatory, not inherently unrelated. Get over yourself.",grateful
This list is phenomenal and your username is witty! I’m saving this. Thank you for posting it!,grateful
Wow that's not how you resolve things. Escalation is the last option.,excited
Papaoutai still leaves me bald.,lonely
I am so sorry! I hope you are okay!,tired
"We were all duped? I’ve seen through her from day 1, even posted about how fake she is",angry
congrats. i'm broken rn but if I wasn't I'd be happy for you,sad
ORANGE MAN BAD GOLD TO THE LEFT,frustrated
"That's not it, the game (sigil is a derivative if scrapheap challenge. Thanks for the suggestion I appreciate the suggestion though.",grateful
Must not hit opponents on the first frame then. My mistake,tired
I’d love some actual lore relating to OW as a whole not just slapping names on single characters once every 6 months,happy
Stay there it’s been good luck,grateful
Oh really. Go ahead and try to reason with an [RELIGION] government that their power should be limited. Good luck.,grateful
Thank you for sharing this. I found my house in 1938. Very fascinating stuff :),grateful
"That's a yikes, no from me.",anxious
Imagine trying to step down from there after you're done and your legs feel like rubber,calm
"As much as I want to blame the gov for intentionally killing off vets, Im just going to go with laziness and stupidity.",calm
Please tell me you were buying something extremely embarassing!,lonely
"I had a nightmare about something similar, the combination of high walls and water is truly scary",anxious
There was one I saw hanging out at Wash Park a few years back.,calm
"First thing I thought of, people need to know these things",calm
Their interests are convergent where it matters: they *all* want more of your money to go to healthcare.,excited
PUT THAT MEME BACK WHERE IT CAME FROM OR SO HELP ME!!!!,calm
"Some of the problems I noticed afterwards, I love the car. The experience not so much.",happy
Are you really that brain dead.....idiot!!!,angry
You’re being bullied. Leave.,anxious
"i wasn't quite sure how waivers worked either, had to look it up earlier :/ not everyone knows everything.",lonely
👍 excellent! I was wondering if anyone else knew this little known nugget from history.,excited
"That's along the lines of what I was thinking, thank you!",grateful
It's very interesting that the fresh water doesn't just dilute the salt water,excited
Looks like pretty much any Donkeys fan.,frustrated
Happy New Year.,happy
That was glorious.,happy
Is this someone?,excited
Try not to mix too much. It will get overwhelming and you'll just end up with bad trips.,tired
Oh ok. Guess the official US statute itself doesn't count?,calm
I’m guessing theyve been together for a few years and once she was no longer a teenager and it wasn’t as risqué he lost interest.,angry
"#Screw you, someone.",calm
I will never be able to comprehend that beautiful flick into a headshot hanzos seem to do.,grateful
Damn this is experience talking.,sad
Is there something I'm missing here? I don't see the pun.,frustrated
"If he worked out he would look good I think. But not in a way I would be attracted to him lol, just in general.",calm
Yes. One of her fingers is getting a sore on it and there’s concern it may push her into needing braces.,anxious
"I love how the dog bites hard enough to pull it away, but soft enough to not kill it",happy
He's not wrong.,sad
"I messed up by trying the sweetened tea. Maybe tea just isn't my thing? Either way, nice to have the choice be my own. someone",calm
"Count it yourself, you're more off than the original post. someone shot her 9 times.",calm
That poor janitor.,sad
"Those pearls are the worst, ugh.",frustrated
Sorry. This thing knows whats up!,tired
I didn’t think I was implying that you weren’t.,lonely
As a contractor this is a huge nono. If it's not on paper it not on your wall either.,frustrated
"I regret not grabbing my work laptop today, then I wouldn't have to leave fort blanket until Thursday.",tired
We're not roasting you. That's not how it works here. Go get help and feel better then come back for proper roasting.,frustrated
Good stuff someone,grateful
"Don't worry, when you turn 20 you'll look back and cringe, too.",anxious
what a cruelly poetic fact,anxious
"Oh god, going to a social event with someone and never leaving their side is me at almost every social event I go to.",lonely
When you're too stupid to realize they showed off character customization in the trailer...,lonely
Right like interacting with each other having a normal evening? Ugh they’re both so trashy I’m sorry.,tired
We're well past the demoralization phase. You're 20 years too late. The left has morphed into something unrecognizable now :(,tired
Dear OP: Proper punctuation please/thank you.,grateful
you too! And I'm glad to hear you support your daughters rock/fandom love:),happy
I definitely wouldn’t do a role change at the tournament but definitely when they get home. I should’ve clarified that sry.,lonely
China cheating the rest of the world is horrible for the economy and society.,frustrated
"This is actually kinda cool, I like it!!",grateful
I’ll see you there. I laughed out loud at this one too. RIP.,happy
HAHAHA YES MEYERS,happy
"No phone, can't help....sorry?",tired
Pls not granny :(,frustrated
"Where? Sorry, the link doesn't seem to work!",tired
I would cheer hard for a Cyborg win in that tourney.,excited
You're back but you're still broken.,sad
Love you (No homo),happy
I’m sorry to inform you that this man is an imposter. I’m actually undercover atm.,tired
"Nah, she cute dawg.",grateful
"Most men who gtow have had relationships in the past that turned out to be disasterous, and now they're just salty about women.",sad
"I apologize, that sincerely was meant for Askreddit. If you look at my history you'll see that's where I always post. My mistake.",tired
Dont call your self pansexual if you've never deepthroted a pan.,frustrated
"Oh man. Hardest lesson for me to learn as a new dm was that even with experienced players, combat with 7 PCs is brutally time consuming",sad
"Strange, I just told a few hundred guns to go kill people. They didnt respond. Are my guns broken?",lonely
"anyone who hasn't seen this, it's unbelievably bad.",sad
Sorry that you lost that stuff. But that's a lot to have in your car in SF,tired
This movie is highly underrated. Part of the problem it has is that Rogue One was SO FREAKING AWESOME!,grateful
Shouldn't have watched battle tendency. Now I frequently have fantasies about the ideal male body and feel more and more homosexual by the second.,tired
"Ah yes, my apologies!",lonely
Enjoying it. It makes shaving my head easier.,happy
"Bay Area, sorry ;D",tired
"Damn, why y'all posting the match threads this early.",frustrated
!delta I don't see why not,calm
You are a great grandmother.,grateful
Saint and Eagles was the only interesting game.,calm
Thanks yeah that sounds good,grateful
"I mean just let it go and assume things aren’t going to work out. Drop it, so to speak.",frustrated
"Lol, I’m so sorry for u. Do u go down on her a lot? If so she need to give something too...",happy
"Wow, AP. Just wow.",excited
"It looked like something on her etsy. Maybe I'm wrong, I just looked it up under her username",tired
"They do get an awful lot of upvotes, so they seem to have at least some support from others.",sad
Maybe so. Should I try to ask her about it? I'm worried that will only scare her more,anxious
"Like the someone twins, I guess.",calm
"Even if you don't act on them, you still should stay away. It's not normal to fantasize about doing sexual things to children.",frustrated
Clearly I need to run for President so that I can blame all of my failures on my run for President.,sad
Can we forget that this moment happened,lonely
Oh jeez!! I didn't know! I retract my message.,excited
Thank you! Well put I am not the best at putting my thoughts into words so well said thank you that was the point I was going for!,grateful
"He’s gone soon I would imagine, hope we can get a late-mid round pick for him, like a 5th",happy
"Glad you liked the lesson, don't forget to SMASH that like button and click on the bell box below to join the NOTIFICATION SQUAD",grateful
"Honestly, this would creep me out a bit.",angry
I’m sorry you have to deal with that,sad
Expectations was amazing - this ain’t it,frustrated
It's a miracle! This is how religions start.,excited
This is terrifying,anxious
In that conversation it was the girl being boring and closed... sometimes it’s not your fault and people feel they’re the ones being awkward,lonely
Well if you read my other posts you’d know I did try to end it in a responsible mature way and he refused sooo,frustrated
Wow I never noticed that either before you pointed it out,excited
I’m sorry on behalf of all the idiot guys. They didn’t take my class. How Not to be Creepy 101.,tired
I don't care what anyone says I love someone.,happy
I hate when people Beijing a gun. Even worse when they Shanghai one.,angry
"This may be overreacting, but I would not touch those presents. There could be a bomb in them.",sad
"Wow, you an asshole much?",excited
"I'm not saying your analysis is wrong or not based on evidence, just that the data it generates is not useful.",frustrated
2005? I think we might be the same person lol. What a terrible year. I go back to that one a lot.,anxious
I thought they were butt fugly,sad
Didn't know about him being a teacher. Camp Bucca doesn't mean much though. Plenty of foreign fighters ended up in those type of camps.,lonely
It really didn't. You were the one who came out hurling insults around. Are you projecting? 😂😂😂,frustrated
"Barring an injury, someone will be up by May at the latest. You're not going to sign him for one month.",frustrated
Wow starters before 6 min mark?? Insane,anxious
He's basically telling the Lakers to come and get him,excited
People are assuming you’ll survive getting your leg cut off right now. Coma seems better.,calm
Another pathetic PP.,happy
Oh dang I hadn’t even looked at her face!,sad
someone was pretty good too. Cuah was the best 10 tho,grateful
I was hoping this would be a case of r/maliciouscompliance It was close.,lonely
Thank you. I needed to hear all of this. I appreciate it.,grateful
See the Imperial Sourcebook from West End Games. That right there will show just how awful a regime the Empire was.,anxious
He now looks like his daughter wearing a fake beard.,frustrated
I might have exaggerated a bit for comedic purpose. I'm sorry. I'll edit it in.,lonely
Food stamps are a disgrace. People should get money!,lonely
Juul is heavy vapor. Idk how to describe it but i didnt feel like that when i used other juices,tired
We don't do that here,frustrated
Stop trying and just do it. Then decide if it’s worth the effort. Otherwise this is just envy.,angry
This is his 2nd marriage that he has cheated in. She refuses to see how much of a snake he is.,angry
No no! I meant it in a positive way. The emotional rollercoaster of the photo album.,frustrated
someone. I just want you to have a great stat day.,excited
Character and emotions are not the reigning champion one year earlier...,frustrated
the older i get the more it hurts,sad
"This is not true, you can still cross train to short fall career fields at the half.",calm
Trailers? We don't need no stinkin' trailers!,frustrated
I would guess from multiple communities if they are trying to win the war against the other group,anxious
Idealogues are annoying.,angry
"That’s what the auto-shut off is, that thing that I said malfunctioned due to the extreme cold.",sad
I don't like someone she is not relevant to the series.,frustrated
😭 I wanted her to be on the top 4; now we’ve heard plenty of times someone mentioned so pretty sure ain’t gonna happen,excited
I know! If it's going to be that cold I want snow. I think there's a chance next weekend,excited
So thankful for the conclusion. Having no idea how this played out was definitely going to haunt me,grateful
"Dammit, you know I proof read this and I thought it changed correctly but I guess it didn't.",angry
I once looked for my phone with my phone flash light,lonely
thanks for the tip. i haven’t been there except for specific shows. i’ll check it out.,grateful
Not all of us young teens eat tide pods Mom would be sad,sad
SHUUUUUT UP THIS IS TOO TRUE,calm
I didn’t get to watch!!!! WHAT HAPPENED!!!!!,excited
"I'm pretty sure most ""pick up"" artists in Asia pay the girls.",calm
Downvoted despite posting facts; even the self-proclaimed moderate subs can’t help but be partisan.,frustrated
"Why do you keep doing this thing where you say you disagree but not why? If you have a counterargument, go ahead.",frustrated
In that conversation it was the girl being boring and closed... sometimes it’s not your fault and people feel they’re the ones being awkward,lonely
I regret this post so hard so much debate and anger lol,sad
That kill was beautiful,grateful
I’m in my second year. Still closeted. Still uncomfortable with my body and sexuality. Still socially awkward.,lonely
"Yup, it all starts with someone. He’s not the worst owner in the nfl, but he’s in the bottom half for sure.",frustrated
You keep turning it into all or nothing lol I said *less* bookshelves will be made if *more* bookshelves are reused,happy
Also the least satisfying answer but probably true haha,frustrated
But we libertarians are incapable of blindly voting for a bad candidate based on party! /s,lonely
Actually that's the wrong guy. The guy you're thinking of is in prison now facing life. This guy sucks just as bad though..,frustrated
"He was injured in real life, watch the news. He'll be back in ep 15 and fully recovered.",calm
Woohoo! He is motivated and awesome!,grateful
I've never been so bored with so much money on the line. I am numb now.,anxious
From the South and can confirm that someone is an idiot and should be saying brink.,angry
"Good luck, I hope you find it really easy! I did, and I’ve never looked back :)",happy
"Huge, huge internet hugs. My heart broke for you reading this. I'm so sorry you had to go through this.",tired
Actually it's true. But it's a misconception around the shyness concept and not about SA.,lonely
"Sometimes though, I wish I could be sad for a whole week; that would be a blessing.",happy
You are so right. Reddit response of reading only the first few words. It's been a long damn week. My apologies.,tired
Oh my goodness.....I'm sorry. It's probably gonna take a long time to cope it.....,tired
If you don’t think this can happen in the US your going to be the reason it does.,angry
What a methy situation!,grateful
He was forced into this marriage,frustrated
Well ‘hanging with the bros’ is happening either way. It’s what I do in the morning.,calm
No it’s definitely you. Time for you to grow up.,happy
"He wants to make excuses for his affair and I doubt you'll feel better after listening to him. In fact, you may actually feel worse.",tired
I'm not a gamer but I always feel bad if I kill an ant or some other bug like that for no reason :( instant regret,sad
I feel uncomfortable how we didn’t see him resurface...,lonely
Is this a scene from Avengers: Endgame?,calm
Whoops yeah my bad And no just from the pictures ive seen there were just u opened sauce packets arranged on platters,sad
r/puns might appreciate this. I know I did!,calm
Thank you. I needed someone else to say it. The unnecessary misgender as a parting shot wasn't my favorite either.,grateful
Her attempts to be “edgy” fall flat are incredibly cringeworthy.,anxious
"revelation = if you aren't doing it after some major event which you also just learned about, you aren't doing it right.",grateful
I don’t owe you an explanation. I’m at work.,frustrated
Yeah sorry about that I don't mean it.,tired
He will the author already spoiled it in previous chapters.,angry
I know I am very worried,anxious
I would like to say that I see plenty of people in their young adult life that are still incapable of living on their own.. lol,sad
Definitely not. It would be so boring to have no chance year after year.,frustrated
I think I'm overly defensive tbh... but yeah this relationship will be ending when I see him next.,lonely
"Uhhhhhh, damn son",happy
"Just build, lol.",calm
You're in for a treat- enjoy :),happy
ME drunk someone kiss ma girl like,happy
She looks just like that dude from Santa Clarita Diet,calm
Fat dont fail me now!!,anxious
Happy cake day !,calm
Damnit. Have a big trip planned for the first week of February. Can't wait to get to the airport 5 hours early.,excited
Sorry its such a long post guys,tired
you're misinformed,calm
"sorry my fellow youngsters, we're illiterate.",calm
"I never went back to the post to see if it was BOA, but I’m not surprised if it was. That was my first guess.",frustrated
Peaky Blinders is the shit. I don't understand how there isn't more hype around this show.,frustrated
I have this problem but without caffeine,calm
He posted about white racists on a post that has nothing to do about racism. Pretty sure he is just racist.,angry
Im surprised those ebrats who tried to steal your step daughter's board didn't complain to the mom about it.,excited
"I’m sure you’ve been accosted many times by the cops, or as I call them “someone fash squad” !!!",lonely
What a nice someone sentiment!,grateful
Sorry !! You’re real good at that!!,tired
Great post. ( you are learning to let it go),grateful
"Weird, huh, how people always seem to look for ways to justify our per capita emissions.",anxious
Female INTP and i concur! Especially the kids bit! And the Adorkable!,lonely
"The one thing I worry about is that the 9-5 ""window"" is keeping employers from demanding workers be on-call 24/7.",anxious
Looks like Big trouble in Little China,anxious
Hmm ... Vancouver is not on the list? that's interesting ...,excited
"someone damn, that is the kind of biting commentary I enjoy.",happy
Congrats to you!! My husband went from being like your husband... to processing cannabis oil. There is hope.,excited
Lol it was worse for them last year,happy
"Penis who, now?",calm
Same...except that I'm not good looking :,frustrated
Oh my goodness.....I'm sorry. It's probably gonna take a long time to cope it.....,tired
It defiantly shapes up the picture.,frustrated
"these have to be probably the worst presses ive ever seen, sorry mate",sad
"Insurance covers stupidity, so maybe they'd cover it?",angry
"“someone, I tried to make ramen in the coffee pot and I broke everything” - someone",tired
"If it's anything like what happened in France, I'd assume because it disproportionately affects the poor.",frustrated
That's good eatin' mate.,grateful
No Brexit is also an option.,frustrated
