text,emotion
Yikes. This kind of freaks me out.,happy
someone was speaking as a man you idiots.,angry
You should dm her and say I'm sorry,sad
Ok. Believe what you want. Have fun starving to death.,angry
Wish i had more up votes for you.,tired
"In 5 days bones would not be crusted over,sorry not buying it.",tired
Sorry sorry sorry sorry sorry,tired
Then you're awfully worked up over people seeing the world differently,sad
"I fucking change my mind, something wonderful has happened! Please don't make me go dead, tomorrow.",angry
Extremely painful to watch,sad
"Hey man, if you need the Chiefs to lose to bring you any sort of pleasure I get it. But at least be classy about it!",angry
"Eh, not in Europe, it ain't.",calm
He's a RFA this summer so we can keep him if we want. We definitely have the space for it.,excited
"Ya know, I hate lying but I guess I'd make an exception for this.",angry
Just drink the bear. Life is too painful and short to worry,sad
Gotta cheat on taxes somehow LOL,happy
>very creepy horror-themed Very accurate description and only from a few second piece of an audio recording,anxious
I’m so sorry to hear that! 😂😂😂,sad
Ehhh he got played so hard on the someone vs someone situation in 2017. Lost credibility after that for me,calm
I was never a fan of it. It should be a regular foul.,frustrated
This moment always reminded me of being a kid and turning on Nickelodeon only to find Nick News with someone. Ultimate disappointment.,sad
Y'all taking this way too seriously...the point is they're both fierce.,angry
My office has very few personal offices. Its awful. Managers need closed spaces so they can talk without everybody hearing,angry
I'm so nervous!,anxious
I'd be ok with it if you get one less card when you mulligan,calm
"Omg I am so grateful for attending your TED Talk. (Not being sarcastic, btw. This is great)",excited
My heart broke for him when his wife suddenly passed away. I worried about him with his issues with depression but he seems to be doing okay.,tired
That escalated quickly.,calm
Now this REALLY sucks,angry
i feel like slapping /s after everything sucks the fun out. it's not my fault people are autistic.... /s,angry
you got me someone,tired
LOL this. I would love to see that.,happy
"Cut rent control, then increase own housing allowance. Because fuck everybody else, am I right?",angry
"In our society it is more shameful to pay for sex, do drugs and to gamble than to praise the death of innocent innocent victims.",lonely
"Given that you're not a conservative and this isn't a debate sub, how about you just get the hell out and stay out.",angry
"Wow, I just googled it and holy shizz that's an insane difference.",excited
Oh boy... it must actually be kind of nice to be completely oblivious to how the people around you are feeling.,grateful
Oh well that's that then :),calm
This. It seems he's undoubtedly someone preferred option.,calm
Also stay hydrated! That was a mistake I was constantly making too,angry
Gotta pay sincere condiments for this rant... if I mustard the strength I'll ketchup to the topic.,calm
i mean yeah but people need to understand when someone needs something other than just sexual comments and maybe some actual support,excited
Please point out my fallacious line of reasoning instead of insulting my intelligence. You are an example of a bigot that thinks he is wiser than everyone else.,lonely
We aren't 4th anymore since our goal difference was just destroyed. He's not going to be sacked yet but losing to Huddersfield would be inexcusable,calm
Trier someone chemistry looking nice,grateful
Dude couldn’t see he had a spool of hair growing on his face?!,excited
And then you finally hit it only to drop it off the end table.,angry
This child does not understand the economy,grateful
Could you imagine? That would be so terrible for viewers. 😂,anxious
"someone maybe next year,i didn't think she was gonna win but hope she gets in the top 30 by the end",sad
Same.... I'm just perplexed,excited
I really love that this sub has it's own little culture,happy
Shame. CLG someone could've been a thing.,lonely
Damn youtube and outrage drama is super lucrative for reddit,angry
I know it's easy for me to say because it wasn't me but money is money. We can always make more. Really sorry dude.,tired
Hi I'm an order of magnitude more awkward than you and I'm coming.,lonely
"Lol, pinches narizones.. Their physical game is on another level. Would rather play with a guy like that instead of against him though that's for sure.",excited
"she said (i swear to someone) her doctors told her she wasnt bipolar and has ""anxiety caused by other people""",excited
We will never survive with 5% unemployment with moderate growth and a continued house building program to correct supply. Sounds horrendous,anxious
You know I’m sad the someone hype is over because I actually think he’s been really good for us overall. I still trust him.,sad
This looks like it was written by someone’s desperate to be “down with the kidz” mother.,sad
"Disgusting trash feminazis, fuck your hijab",angry
Pure unadulterated hatred. It’s disgusting.,angry
I was wrong so I'm just going to pretend I don't care.,tired
He really would be. It's not even an abortion anymore!;It's just post-birth killing!,frustrated
"Oh man. I feel so bad for her, but am morbidly curious at the same time. Got more pics?",sad
"If you're in luck, she might be waiting to be independent and find you but the chances are very slim.",calm
Oh I’m sorry. I assumed. I think that would be suspicious if your username was known to someone else.,tired
Signing someone and someone is not fucking around? Lol,happy
Oh someone all the cereal will be stuck soaking in milk until they get mushy and gross,anxious
"Not the snowbank, though. That will end badly in spring.",angry
He's the only one who has managed anything positive in this game,grateful
Now think about the point I was trying to make. It wasn't that I talk to servers and ask them if they like tipping more,frustrated
Awkwardly remembering all of those promises I made mid-panic attack...,lonely
"I stand corrected, my apologies to the mods. I'd personally like to see more banned or removed but at least they handled the most egregious.",tired
Same here. The ones who know me and my obsession always let me know and it makes me happy.,happy
"Ah the ol' cucked boyo. Whatever after what I've seen you won't change my mind buddy, that's for sure.",calm
I always get a kick out of the videos posted of cars and buses stuck around that area. Bathurst going up to St. Clair is also notorious.,angry
Downvoted before I realized what sub I was on,frustrated
"That's what I was talking about. Eat one meal, then hibernate until you're so hungry you gotta eat again.",grateful
"If you’re talking about 玛雅, I checked and they’re permanently closed. It’s a shame since the location would have been perfect.",lonely
No that's communism not socialism. There's a difference between them.,frustrated
"Yes indeed, the “just a joke, bro” ship sailed long ago.",happy
"Not surprised, damn that sucks. Concussions are awful.",angry
"Oh, the show that had someone? Yeah screw him.",angry
Hence the apology note.,tired
I feel sorry for this little girl. She's legitimely scared.,tired
"Sorry, but someone doesn’t even compare to someone.",tired
"Our country is in no way, shape or form ready for the risk of a giant inflation wave.",sad
No sorry still looking,tired
This chick is a lunatic now,sad
NO BOY! NO MORE FREEDOMS TO GO AROUND HERE! Now go back to your room and give me your toy guns immediately,angry
"Believe it or not, I actually am. With the exception of stupidity.",calm
"""But it's okay because people get stoned to death in the Bible!"" -The creator of this comic probably",calm
The real tips are always in the comments :D,happy
He didn’t exactly leave on great terms with the club. It’s interesting someone is not even brought up anymore regarding psg transfers,frustrated
This wasn't exactly aimed at the national brain trust.,frustrated
Yes. Then then dead teammate has to spectate for 20min. This is no where near as bad on PC as console.,calm
"Yes. The Brasileiro is a notoriously difficult league, and Corinthians aren't even considered to be a rich club.",frustrated
"You know it doesn't use the word ""boycott"" at all, right?",angry
"genuinely surprised me, 0",excited
I found it using Guide to Purposeful Success. Hope it can help you the way it helped me!,grateful
Shootouts aren’t our strong suit. Happy to get out with a point though,frustrated
"Sorry on mobile and limited data, decided to cut to the chase",lonely
Don’t have someone who didn’t wash their hands put in your contacts! Come on!,angry
Well he hasn’t dont anything good ever. So sorry I’m not very excited about this trade.,tired
Here's a great essay by someone regarding the Skripal farce that I've just run across:,grateful
"isnt that halloween or like easter, man people are weird",frustrated
The fact that he allowed himself to be bullied and pressured means he obviously lacks the courage of his convictions and should step down,lonely
Self confidence I think and the fact that I’m scared if I do give all of myself to some that they won’t reciprocate.,anxious
You're pushing me to adopting irrational and nonsensical beliefs! dogs are cats now!,angry
someone kid got flyer shoes than the rest of us,angry
So weird watching this segment knowing what happened a couple days ago.,frustrated
"You just worded it badly, like we all SHOULD want to see it change, which many of us don’t.",frustrated
In my eyes 6 La Liga’s in a span of 18 years is just embarrassing,lonely
I'll take these close thru 36 minutes Ls over a loss by 25 and was never in the game Ls,sad
I’d love it!!! Can you get it to Long Beach?,happy
She hasn't even fully moved out yet and I feel the same way. I'm sorry. I know how awful it feels.,calm
You can't talk morality to psychopaths.,frustrated
Read his post again. 'It's more fact based than Fox.' I'm sorry but you might have some extra chromosomes.,tired
"Sorry guys, accidentally sold 10,000k",tired
It's not there he is just being his usual jerk-off self.,calm
"You will watch porn again, don't try to fool me",angry
it's a damn shame.,angry
Can’t fault you there,tired
We don't have any options. Having said that I think someone should have started.,calm
This one will provide tasty meals and a cute pup too,calm
Look up info on being an empath. I am one and am complete drained after outings even if I had a blast.,frustrated
It's not hypocritical to find annoying behaviour annoying. The two situations aren't mutually exclusive.,frustrated
"Aha! This is my fear, that the gloss over key elements because they want to target a wider audience!",anxious
I feel like people who post these are too in denial to realize it looks like a cry for help,frustrated
"Waiting for it to get better as it’s been getting progressively, exponentially worse for 7+ yrs now",sad
I can't keep up! This drama is too much 😭🤣,lonely
"Haha yeah, apparently their ringleader just got banned on Twitter.",happy
Sorry you’re not allowed to be a Vikings fan anymore then,tired
Thanks so much for taking the initiative to do this! Not all heroes wear capes :),grateful
YOU MUST CONSTRUCT ADDITIONAL PYLONS,grateful
Imagine thinking like this. I feel kinda bad for them.,tired
Yup. Soft serve turd special,grateful
General population are scared of press,anxious
And she wouldn't give it to him. Poor fellow.,lonely
It won't be. Just a rumor.,frustrated
someone don’t make up only 2% of the population though. Edit: I mis-read. I’m sorry. Please ignore this comment.,tired
I don’t know where you live but in my area people don’t really care to have a good-faith conversation with an anarchist.,frustrated
*10 minutes of awkward roleplay*,lonely
I came here to upvote the first throwback someone comment. Wasn’t disappointed.,sad
With punctuation like that I'm surprised you're not from Jordanhill,excited
Awe your such a big boy,excited
I skipped the Oilers game for a birthday party for a cat. I’m glad I did that instead.,happy
You seem nice but things will remain this way until someone makes a decision based on your coworker being incompetent and lazy.,lonely
Being demoted for having the best ideas in the office doesn't sound like a good business strategy.,frustrated
You are unfortunately far and few between.,sad
This is why I’m afraid to fly.,anxious
"I also posted about this a few days ago. Maybe they have different designers but none of them has follow-up or approval from a single person, unfortunate",sad
Now this is oddly specific,excited
I’m stuck at work tonight so I missed it 😢😢,anxious
"Doesn’t sound like it’s going to work out, sorry dude",tired
I'm ashamed that while trying to figure out what TKE stands for all I can come up with is Tau Kappa Epsilon.,lonely
Fruit is byfar the worst of all flavors,angry
"Sorry, I have plans that day, week, month. Watching TV while you peruse Reddit are plans aren't they???",tired
Yess! Some of my favorite lines from the trilogy. someone killing joke monologue still seems very relevant today.,happy
>But a leader who strikes fear Like when people were worried someone might murder them?,anxious
No that's stupid,frustrated
"I don’t know her, I just thought it was funny how the titles of that post and the post under it went so well together.",frustrated
"Thank you for the notice. I'm mainly on mobile, so I tend to ignore rules",grateful
Doesn't suck nearly as bad as Metropolitan Grill. I'm surprised that place is still open.,excited
Not yet! But I waiting for a miracle any year now!!,excited
"Apparently, his knees aren't as bad as we thought.",frustrated
"Yeah I regret ever moving to Leduc. It's one of the most backwoods, proud-to-be-ignorant communities I've ever seen.",tired
I’m a big Spider-Man fan and this looks terrible compared to Spider-verse and the PS4 game.,anxious
More fake news from CNN. I thought coming off the last fake news blowup they would at least bother to watch the video before writing their ridiculous story.,angry
The sad thing is that most of them are gone the next election anyway.,sad
He looks like bob saget,excited
Hes literally making 15 an hour,excited
Replacing pillows often is also important. Buy more less expensive pillows. I love pillows from Ikea.,happy
Is diy crafts getting ready to go to jail? 'cause these are some jail life hacks.,happy
"Manipulation. I love my mother btw, but this thing is insidious.",angry
"someone, this isn't a guy who built the railroads here.",frustrated
Not exactly the cream of the meme crop there. And on a personal note I don't think ironically bad memes are funny.,happy
What's that like? Like what's the thought process? I dunno. I know what's a weird question..i just can't imagine,angry
The only thing I find disconcerting about this is that you use tongs to stir the pan.,angry
I am sorry but you dont have a saying in this matter. Its up to your parents to solve this.,tired
If everyone agrees I'll witness this bet. Just so you know the NRA and Kremlin don't count as charities though.,calm
No no forms or anything. I was pleading with them not to go and it seemed surreal that I was being forced to go,sad
That isn’t a prediction that is exactly how Crisis on infinite earths played out,sad
Aw poor kid. At least he has a bomb-ass name. Too bad he probably doesn't remember it anymore.,angry
There is a surprisingly large number of someone who play.,excited
"Reddit is being way too forgiving of someone for some reason, it's an odd nerve that I've touched here apparently but keep the downvotes coming.",anxious
"I'm with you, pulju has been looking dangerous lately",anxious
It's practically non existent. Im mostly afraid to initiate a hug because I'm afraid I don't know/forgot how to hug.,anxious
It's not G A M E R time unless we get to berate women and minorities.,lonely
"The history of horrible things the federal government has done is well documented. The same way the federal government does it, with income taxes.",anxious
"Very interesting link, thanks for sharing. Happy New Year!",grateful
But muh narrative! Orange man caused this!!!!!,sad
"Sorry, is Russia depicted in the cartoon?",tired
someone path made me hate everything associated with pirates,angry
I dunno...it was used for a meme and it's very fun to look at,happy
"Boo for them, we're all yarn fans!",calm
Please elaborate on that story! Ive always been afraid of exactly this happening to me.,anxious
"What part of ""Obviously it's not the one in question"" were you unable to read?",calm
I don't get it. Maybe i need to position myself better to get dibs on batches. I literally have only made $60 a week.,angry
"I'm more worried about him scamming children than ""oNLY"" scamming them into thinking they'll get $100.",anxious
this guy is such a douchebag,frustrated
thats cool to hear ... someone really is laughable in this regard,happy
OH someone THAT'S TERRIFYING SOMEBODY SAVE US ^/s,anxious
"someone, what? That's pretty hilarious and disgusting.",lonely
Thanks! I didn't understand til now,grateful
I dream of a world where that won't even be an option.,frustrated
Wow. As much as I like pizza I would get sick of it if I were to eat it every single day.,excited
Me too. Scorpion sounds so odd now,happy
"Well, since everything in Australia wants to kill you, I'd say it is quite healthy to be afraid of Australian spiders, and other flora and fauna",anxious
Damn. Moving like that in those heels is impressive.,grateful
"Finally! Now I see what I was doing wrong. PB, thank you!",grateful
I don’t think anyone will miss me either aha,sad
Been getting this same feeling these days.. idk what it is I just have no drive anymore maybe once the cwl comes back it’ll help,sad
It sure smells and feels nice. I also don’t find my hands as dry as usual compared to bar soap.,calm
It's so goddamn funny.,happy
"Girlfriend is straight off of Shop Hush social app and onto reddit. Someone tell her, its slightly embarrassing.",lonely
"None. If she has insecurities, I latch onto them like a barnacle.",calm
It becomes manageable after I get prep going. But first thing in the morning it’s always a mess.,sad
I sleep alone on the floor. That was a bad idea...,tired
This guy sports entertains.,happy
"I was won against an ultra-hard brexiteer, he tried to hit me with an uppercut but I just teleported behind him.",calm
omg that's gonna be a hell of a reunion as well,angry
someone was horribly inconsistent this year,anxious
"Coherence, The One I Love",calm
"As far as I know, it's still bugged, so just reroll it",angry
"No, the full video shows that the kids surrounded and berated the native elder man",frustrated
"To each according to their needs... Except entitled parents, who need everything.",excited
someone was awful last season. Let's sign someone instead.,calm
No way society should pay for your child when you are perfectly capable.,frustrated
I couldn't reply to the message I got the other day,sad
"That's not really true, people judge all the time, it's just that they're usually too busy judging themselves to judge you too.",frustrated
I can't watch Isco rotting on the bench and LV playing instead.,frustrated
If I got killed by someone while they're stunned I'd uninstall my game.,excited
> no child should go without needed medical care. Or adult.,grateful
I'm still rocking my Pebble 2SE.,happy
"Damn, that's the only war we lost.",tired
Sorry *ss Crabtree is there so it's a possibility.,tired
And the amount of crops we eat is destroying river systems and forests. Not to mention the animals killed inadvertently during harvest.,angry
Someone should do a “what posting any related someone romance is like.” The comments in these posts are a real treat.,grateful
"I am so thrilled that you broke through that constraining ceiling, or that ""tunnel vision"".",excited
"I earned the money, I bought the food and I cooked the food so don't go thanking your phoney baloney god for it in my home.",frustrated
That beat is mad smooth,grateful
Carmichael is near the bottom? Find that hard to believe. someone just under McDaniels? Words cannot accurately describe how inaccurate that is.,sad
someone how is someone even a rapper. I thought rappers were people you would wanna be lol,happy
Every red light should have one of these!,calm
Oh look a player breaking out of a slump against Dallas. Haven't seen this one before,excited
Still don’t know how someone said him and someone will be battling for years while keeping a straight face.,sad
"I feel like that would just be a net positive for guys, is that what she wants?",calm
"I actually got her IG from the video above. If it’s an issue, the video should be removed.",calm
"Yeah, it makes me feel worse :'( I need a real one...",frustrated
I noticed this last night when rewatching someone. Her daughter was easily 400 pounds.,calm
"Thank you, I need it. I am currently trying to learn French, would that help ?",grateful
Honestly scared to see what happens,anxious
Extremely painful to watch,sad
"I regret not grabbing my work laptop today, then I wouldn't have to leave fort blanket until Thursday.",tired
Having this issue as well it really does me in,sad
"My hunch is, this is not the first or last wedding this bar has seen",frustrated
>It is tailored to your viewing history. That's fairly common knowledge nowadays isn't it? Weird thing for the comic to point out.,lonely
I drool over Elijah woods,lonely
> This isn't where I parked my car Seriously I can't find my car.,anxious
I blame someone for this series of unfortunate events,tired
None of the movies deserve it and honestly the oscars are a sham at this point.,sad
"anyone is allowed to talk to a therapist, and get counselling. that was never the issue",calm
I’m not crying... I’m just cutting onions... I-I’m making lasagna..,calm
Well dang. Seems like there’s no tried and true method then.,angry
"Someone will actually spend their money on this too, that’s the sad part",sad
I still can't believe someone actually gonna be in Smash.,excited
Got to love all the fake fans that know nothing about hockey!,happy
Yep. The problem is definitely regulation and not wealth hoarding supported by corporate money controlling politics. Temporarily embarrassed millionaires unite!,lonely
My bad if I just leaked /u/keypuncher and /u/ibiteyou 's Christmas card photo...,tired
Thank you someone.,grateful
AND THEY ARE REALLY ANNOYING WE MADE FIRST CONTACT 30 YEARS AGO AND THEY'RE STILL SENDING US TERRIBLE MINION MEMES,angry
IANL I have never thought twice about doing a little extra shoveling to help a neighbor. Can't imagine that it could be illegal.,excited
Lmao good luck getting forgiveness with that,calm
Not a point I’m trying to make. 👍,frustrated
I do believe there is a dm function on Reddit. If not my email is,angry
That's a cute kitty :3,grateful
That was an horrendous season to an otherwise amazing show,anxious
Are you my coworker? I swear my boss will randomly scream and its embarrassing.,lonely
"I don't know why, but the thought of that hat on smoke makes me smile...",happy
No no I’m repeating it because I absolutely love the descriptor! It made me crack up.,frustrated
"Reality: someone sees a pet outside and thinks it doesn't have a home, so they adopt it.",happy
Oh my gosh!!!!!! 😂 you poor thing! Thanks for sharing!,grateful
Conversion to make gay people straight. It's horrifying,anxious
"We had a clown banging on dorm windows, on campus, with a knife in 2016. Was terrifying.",anxious
feeling like im not normal and that im shameful and wrong and other people telling me those things are what have done this to me,sad
I'm not worthy to watch this haha,anxious
"Her upper lip always looks terrible - such an easy fix, can’t believe she is so vain and never bothers to wax",anxious
Don't feel guilty. If you don't leave it will be continuing the cycle of abuse for your children.,grateful
"When someone is that crazy, it's probably best to deescalate and go about your day rather than risk them doing something truly crazy.",happy
someone - I misspelt and can’t correct it now,lonely
"someone, I had. It *was* a repressed memory, thanks.",grateful
"Ah, alt right thinking. Afraid of people who have anything 'upstairs,' or 'between their ears.'",anxious
"Sorry, I would like your comment, but it's at 666. And I just can't bring myself to change that.",tired
I’m sorry you have to deal with that,tired
I can’t see many players having a problem with someone being gone. Sometimes a coaching change can create the jump start this team needs.,anxious
And to think all along I was wondering if it was left hand turn day or just me!,excited
"Oh she'll most probably die in that route for sure. I just hope she doesn't get a lame death, that's all",happy
They fully divorced? I thought they were just separated for now,calm
I have that problem myself sometimes.,anxious
"They’re not pissed off to the point where they’re actually going anywhere else, and that’s just crunching numbers.",frustrated
"I have this too, so don't worry. We are not crazy. Just regular humans who happen to have an anxiety issue.",anxious
Ugh Morons stop breeding,calm
No we just want to make sure that it doesn't happen. Fairly large difference.,grateful
You'll miss a begging old man asking for a spare coin. RIP,tired
It is the recent patch most likely! This never happened previously.,excited
There is nothing wrong with showing progress. Teams don't go from being last to best in just one year.,calm
Cheese Most of my friends love cheese so much that I’m scared to tell them that I can barely even bring myself to eat it,anxious
"162 Again, for the 7th straight year. Like usual lol",happy
ok that's kind of cool....,grateful
