text,emotion
This is creepy af,calm
"Yes dumbest person on all of Reddit, please make a youtube channel for all of us to laugh at.",excited
He can’t be like that in that business but it already sounds too late. No wonder his staff quit on him.,calm
"You mean *colloquia?*? You guessed wrong, it's my third language.",excited
"always try to avoid triggers - my last 12 day streak was suddenly toppled by a trigger - no urges and then, suddenly, a *massive* urge",grateful
"No, that looks h*ckin delicious",excited
"Don't bother, redditors hate Israel",calm
"This is me all the time, a mixture of anxiety and dread.",anxious
Hold on to your butts!,grateful
"Well, it is generating them. It has a vector space (latent space) from which you can pick out a face.",frustrated
I was worried about that too honestly,anxious
someone why are there so many guendouzi haters?,excited
someone. Haha r u someone??,excited
"Wear you're ear pro kids. Styro plugs are cheap, and don't ruin the concert experience.... but it will save your ears.",grateful
"I would be unfulfilled and unhappy. I enjoy meat, thankfully I own my own plot of land and can hunt on it at will.",grateful
"Got it! I wasn't aware that it was a slur, and thought that it was just a general term used. Thanks for the info.",grateful
"I'm sorry, there is no way this guy is Canadian.",tired
"Not really, I like staying at home. When I go out for food I'm in and out of the store as quickly as possible.",happy
Oh shit. You’re that bet welcher aren’t you?,excited
someone seemed pretty pissed at himself for last game and kept saying at the end watching the film inspired him to go hit the gym,calm
can we stop posting stuff like this? It comes off as desperate *edited for typo*,frustrated
"I mean, I hope so. I bought his jersey, which would be embarrassing if he was out the league in two years.",lonely
You called yourself a Met fan. THAT is embarrassing. Edit: called themselves a Met fan and didn’t know who someone was AMD disrespected him.,lonely
Oh my someone coco I’m so sorry sweety,tired
"I love how nobody posting here to decry the buzzfeed article is using their actual accounts, they’re all throwaways. Cowards. Just like your felonious President.",angry
> you're probably a little bit of a closeted nazi yourself. I'm just SHOCKED that someone named someone might be a fascist,excited
Lmao I'm sorry!,tired
"Happy birthday, someone!",excited
.... That literally made my stomach clench. I can't believe they are charged for the samples... Just eww.,angry
I'm still surprised this thing is only 2 Lanes in each direction,excited
"> The most important part of the adduction machine. However I am thinking, akin to being asked stuff like that, everyone will be awful.",anxious
"Sorry, I meant let them know outside of class.",tired
someone isn't exactly a lyrical genius set's be real: that dumbass just couldn't come up with a different rhyme.,sad
"You, telling me that changing the clock increment no.s took 1 month?",calm
"Hypothetically if someone makes a run with foles and decides to trade wentz, I’d give up someone in a heartbeat",sad
Coming from someone even though it’s a hypothetical question it’s still gotta feel scary,anxious
I thought he was guaranteed to sign with the Padres lol,happy
"Thanks for answering instead of ""but hillary"".",grateful
Hallmark movies are the worst culprits.,angry
Oh my god Del Monico. Horrific. Even the ambient smell in the hallways makes me gag.,anxious
Oh my *FUCKING* **GOD**!!,excited
"“Wow. Just .. wow. Read a book, sweatie!”",excited
The world needs more Attack of the Killer Tomatoes memes.,happy
SATURDAY! SATURDAY! SATURDAY!,excited
I don't care anymore.,frustrated
That's when they brew their second cuppa before work haha,happy
USC had 4 guys commit 2 fouls in the first half. This might become a war of attrition.,anxious
Me too. Scorpion sounds so odd now,lonely
Cafe hopping today! At the third one now. Might be too much coffee for me in one span though.,happy
Nobody is shaming them for trying to stop article 13. Youtube is being shamed for being hypocrites.,lonely
This is the first time in the last two years I've seen somebody compare current politics to a series other than Harry Potter,excited
"I actually realize this today. Woke up, swept the floor and the bathroom, have being amazing all day long.",grateful
Thankkks and np,grateful
Wow starters before 6 min mark?? Insane,sad
Take this down my dude. This is cruel.,anxious
Looks like he deleted it. Can’t find it on his profile history,tired
someone has made a career out of making strange films.,calm
"He did a someone score? ... yup, that's how unmemorable it was",sad
"Yeah probably should've chosen a better sub, but I couldn't think of one",tired
And what about selling your precious mind creation to someone that doesn't deserve it?,anxious
"Why delete it. It's relatable, never be shamed of what you're going through.",happy
"Omg, this reminds me so much of my uBPDw saying ""I need a real man. I need you to be my hero!""",excited
Let them argue. We've never done anything remotely as bad as MOST OF THE WORLD does routinely.,angry
But do you have a notoriously shady history a la Jax? (Hope not),excited
It just feels nice to share uplifting energy with people.,happy
He is holding you hostage. Sad state of affairs.,sad
That makes me super hesitant. I wouldn’t be upset if we end up with him but the last thing this team needs is raw players.,lonely
"I'm going to look so handsome for you, someone.",happy
I’m afraid it will eventually go that way.,anxious
> Government is not entitled to deny contracts because of free speech. Literally yes they are lmfao.,frustrated
Not to mention the billions sent to Israel each year that they use to oppress the someone,frustrated
Close your damn mouth before it catches a fly,angry
Driving drunk and killing people is where it stops,frustrated
That's almost 175 years,grateful
"Δ sorry I completely forgot about these, but yeah you definitely changed my view",tired
Hopefully one day EA no longer has exclusive NFL rights...,calm
"As someone with sinus and breathing problems, this makes me anxious and short of breath just looking at it.",anxious
Oh sorry I gotcha,lonely
"Agree, I avoid of the ones that do, pre-ordering any AAA is a no no now as well.",calm
"Doesn’t sound like it’s going to work out, sorry dude",frustrated
Is it bad if I didnt even know he was on waivers....,lonely
Cloning shouldnt recreate sensitivity to the Force.,frustrated
"they sounds like autistic meltdowns triggered by an immense fear of vomiting, nothing much to do",angry
"How crazy is that, matrix confirmed.",excited
That sounds awful. Do you like that schedule?,anxious
“I am going to be going through a nasty divorce in a few years so I will need the money.” - someone,sad
"That actually sounds like it would help, I’m glad it worked for you and I hope you eye is ok now 👁💪🏻",happy
Ah thank you! I just remembered it the way I said. Was never sure if that's what it meant.,grateful
He’s a brave man.,calm
He’s going to the Bengals at 11 and I hate it so much,angry
"Maybe you should try watching it before commenting on it, otherwise your just posting from a position of ignorance.",frustrated
"Thank you, I'll try that. And yes I'll definitely thank her if I see her again.",grateful
Fuck shit bitch,angry
"Bah gawd, she is broken in half!",sad
"Would not put too much trust on the numbers, Canadian journalists did a test on couple of these services and got different results between two identical twins.",anxious
> This isn't where I parked my car Seriously I can't find my car.,angry
Still depressed but I didn't run away so it cool,anxious
why did i expect this to be anything other than what it is,lonely
"Unfortunately on my end, it’s only pecks during sex. Pretty boring. Never open mouthed or anything like that.",sad
Happy Cakeday! I met my partner of 6 years at a London someone meet-up 🤩,excited
"Wow, that was really terrible 😂 -ps, I have two really good friends who think this guy has deep wisdom 😭",anxious
Why does everyone keep assuming that we’ll suddenly sign big name FA’s? This is a terrible idea.,anxious
I always wondered where it was on ormond. I managed to find the toolbox last week on yamaoka as killer.,excited
I've seen a number of them on there. I regret seeing most of them but some are legit movies.,tired
It’s sad that some parents can’t accept some simple mistakes.,sad
You're getting downvoted because every one of your comments is condescending af,grateful
"No, that's not standard, it's a common house rule (and is often published in the instructions as an alternate rule as well).",frustrated
Stoop Kid’s afraid to leave his stoop!,anxious
Are 3.0 still active? I was really hoping they would have gotten signed after their tryout camp a couple years back.,happy
"so you can't state it definitively, therefore you think it's a possibility so i was right all along. i thought so",calm
"I never even thought of that, just that it’s the most uncomfortable way to sit in a car, especially on the driver side!",anxious
"Lol, I’m so sorry for u. Do u go down on her a lot? If so she need to give something too...",happy
Dammit I got whooshed,excited
"You do, you forget it all & bam something reminds you and it all comes screaming back. Breathe in truth, breathe out bullsh...",angry
"As a furloughed fed, this does indeed lift my spirits. Thanks for putting this on my radar.",grateful
Thank you someone goodnight,grateful
"Absolutely is, sorry. I just came by to say Howdy back until I saw all the hubbah. someone.",tired
"I know he will be, I'm just nervous. His face is just going to be so sad 😢",anxious
I went to college to get an MRS and all I got was this lousy BS!,anxious
That awkward moment wHen someone already used shell as a pun earlier,lonely
That's an unexpected pair of fighters.,excited
I’m so sorry for your loss and even more sorry about your mothers shitty reaction. I hope you’re doing better. ❤️,sad
i got a bump and a bald spot. i feel dumb <3,sad
"I'm saying put up or shut up. If you can't back up your point with evidence, your opinion is worthless.",calm
Haha! I was right :D.,happy
:). I got you brotha. Dame says hi,calm
"Yes, I could do that, except it's his personal facebook, so that's kind of weird.",calm
"Sorry to say it, but you will have to do that for now It sucks",sad
Oh perfect- I am surrounded by [RELIGION] and they LOVE those kinds of “parties”,happy
Useful distinction - thank you.,grateful
"Here, kiddo. Happy cake day. You need it more than I do.",happy
"I used to work with a guy that was always whining how tough his life was. My family this, my friends that. Very annoying",angry
"It's great, though kind of painful if you ever had dreams of writting/drawing/making a comic/game/novel it hurts a lot.",grateful
Crap. I need more Excedrin. STAT.,sad
I’ve always wondered why they play at ear splitting volume instead of one where you can enjoy the music.....,excited
Feeling this so hard right now. Virtual hug.,happy
Couldn't tell you. Unless i check the news i hardly notice the shutdown,calm
someone looked just as bad as someone.,lonely
Blatantly fake.,frustrated
Thought someone had a bad game. For such a strong player he didn't get to keep much of the ball when in possession.,sad
This cheat... what would that be? I may have made a choice I'm currently regretting.,sad
"@lies_about_flossing, sorry if I used the wrong pronoun.",sad
I actually listened to the entire joke... and I read the press release from the CHRT. How about you?,excited
"Hm so sad. Am I supposed to feel bad for you because you don't look like someone phelps? Btw, he's on steroids no doubt",sad
Don't worry you'll outlive them.,anxious
this depends on being upwind from the bear though being loud and prepared in bear country is never a bad idea,calm
The worst thing is when you find it in a place you know you looked first.,angry
Federal employee here. My amazing tenant offered to pay two months in advance to help with my cash flow.,excited
I agree with the last statement but apparently I'm also bad at matching pokemon to rep :(,sad
"Fat is always unhealthy, and never a sign of beauty.",frustrated
A long term relationship with pizza? Wow talk about accurate!,excited
"I agree with all of this except for someone... he wasn’t really all that bad of a guy, someone needs to take his spot.",frustrated
Neither is beating people up,frustrated
Plot twist: they don‘t Want to Go To school,frustrated
"It says ""Just because someone *is here* illegally…"" No comment at all about how they got here.",frustrated
For free? Tell him you ain no prude. You want $100,calm
Yes the achilles gave out and so did my hopes. I miss brandon :(,sad
If this is serious mate it’s not the kind of shit you should be posting on reddit,sad
"Yeah, he does. Just because he draws different conclusions than you doesn't mean he isn't reading someone. Get out of your little bubble.",angry
". I’m a dude so I took sleeping medication and meditation alike, not respect/reverence for one day dammit.",angry
Sounds like a really bad time. Just wait till you have a nice time and place to trip.,sad
I didn’t even realize it says it right there. Sorry,tired
someone is a moron. Why take the ball away from your best player and give arguably the best RB in the nation the chance to run it out.,angry
*Unfortunately that’s the world we live in now* someone. someone women ruining everything.,calm
"Got it, looks like they're in my vicinity. Will keep this on hand- much appreciated.",grateful
I'd rather be bitter and angry than miserable.,anxious
"Yeah lol, my bad.",lonely
OK. caitoz is an someone shill and closely aligned with Russia. Enjoy irony!,happy
"Sorry, I meant let them know outside of class.",tired
“So a guy cusses you out for lowballing him...”,lonely
"That's that frequency dying in your ears. Enjoy it, because you will never hear that exact frequency again",happy
"Same, nights are by far the hardest. My STBX and I are living together until June and it nights suck.",anxious
Not possible? Not that I’ve heard of at least.,angry
"Girlfriend is straight off of Shop Hush social app and onto reddit. Someone tell her, its slightly embarrassing.",lonely
The someone of horror!,anxious
"I'm curious to see the difference, but sadly that's not really something you can just ask someone.",sad
I’m so sorry the internet has inconvenienced you,tired
Oh man this is horrible and the best summary of this subreddit in one single comment. I love it. Thank you so much.,grateful
We thought we had seen the lowest of the low in 2016. Wait for 2020 it's going to be ugly.,calm
I am ashamed of your sequel memes. Prequel memes or no memes,lonely
I love this contract structure especially since someone is only 31.,happy
Ah true blue love,happy
It's not funny. Your neighbor doesn't sound very bright.,angry
I remember in the mid to late 90's my mum printing out offices jokes to bring home.,tired
Holy shit that SSP was beautiful,grateful
Why shall I? It’s too much fun reading comments written by distorted bubble people ;),happy
Also a tacklebox is what you keep fishing gear in. Not sure if the football thing was a reference to that.,frustrated
at some point you just have to make some shots -someone,calm
Breaking bad all over again,sad
"Malevolent as I've ever been, head is spinnin'",anxious
someone that bottom picture. the brows mixed with the hair terrify me 😰,anxious
"Middle guy doesn't look to fit to me. Looks like me, too many pounds.",frustrated
Predatory towing is getting ridiculous. I have up to date stickers for all the properties I maintain and have been towed twice. Fuck em.,angry
He said this awhile ago. His splits away from coors scares me.,anxious
Sounds like you are the one with salty tears mate,frustrated
"No it’s from the us, the only Aussie one I know is ziip",calm
Not sure if very professional image journalist or avid porn enthusiast but good job all the same!,grateful
Isn't that exactly what the Dunning-Kruger effect is - someone over estimating their understanding / ability?,calm
I don't think that option in ranked would be a good idea.,frustrated
Been saying this shit for years. Sorry not sorry,tired
I like waitresses. Aren't they swell.,happy
If they killed off women they’d start finding reasons to kill eachother off soon enough too.,calm
That’d be lovely. Although now I have to root for AD to the Lakers which makes my chest hurt,happy
Prayers for Dipo you guys. Just had a gruesome injury,anxious
"Your 'brother' had texted alot of girls and ended up on in Internet many times then, what a celebrity! Did everyone clap as well?",happy
OmG pEyToN iSn'T gOoD eNoUgH tO hElP uS iN tHe PlAyOfFs! Dumbass Broncos fans circa December 2015.,frustrated
This scene was priceless! Trash TV gold.,grateful
"Sorry guys, accidentally sold 10,000k",tired
"I was dispointed in 5. it was clearly thrown in to sell 3, as they wanted to make 3 not 5 D.",sad
FEAR THE TURTLE,angry
omg you like totally caught me!!! i'm just a silly social media girl named someone,excited
Absolutely brutal.,frustrated
I just never felt like a boy. I hate my body and I just feel like I can't express myself for who I am.,lonely
You’re buying a hipster truck then demanding INVOICE PORT PDICE. If they don’t broom you won’t get a survey for sure lol,frustrated
Thank you I hate it,angry
That has gotten me killed a few times lately.,angry
"What’s with that woman waving not to record, thanks someone for nothing!👀😐🙄",grateful
So I've never seen someone before and decided to Google it out of curiosity... Cheers for that,excited
"Vamos someone, keep fighting!",angry
I arbitrarily hate poo-lice Get OUT OF MY POO,angry
Somebody is really insecure about their career decisions.,anxious
I'm afraid I'll pick something else.,anxious
"Great piece, thanks for sharing.",grateful
Makes it a lot less stressful tho. Regretting staying up this late tho,tired
"Idk why you got downvotes. These officers, furry and not so, protect and serve and save so many loves. Have my upvote sir/ miss.",sad
It would be terrible if he died and they put his head in a jar or something,anxious
"Idk, the Teen Mom subs are bad for this too. Really bad.",sad
"Idk, I just need someone who cares but I always lose everyone and I’m sick of trying to be good enough.",sad
And on her birthday! She is a rock star for sure tho. 🤓,calm
"> the heartbreak of a nice older truck being ruined Lol, the truck was new when this video was made.",happy
Ohh looking cool Jok- Get out of here side character.,angry
Ah the infamous someone. How I've suppressed that name from my memory.... Until now,tired
Wait... today isn't April 1st...,excited
"Not surprised, especially coming from a society that essentially puts expectations of children way too high....",angry
Reality i could force people to have sex with me Im 14 btw,happy
Your dog is so brave ❤️,grateful
It’s misleading. Better article:,frustrated
this is why she killed herself you sick freaks,angry
"I see you're a new fan, enjoy your stay!",grateful
"The bruised banana kit is only 👌aesthetic👌 cause it's a meme, I swear if the kit belonged to Huddersfield or something people would think it looked ghastly",anxious
someone I’m so sorry sweety,tired
Glad he survived or it might have become a *dead*lift.,happy
This sub is becoming a “Gamers rise up” parody of itself. This is ridiculous.,angry
"Good lord, that 'chandelier' made entirely out of antlers is pretty ridiculous 👀",sad
The cruise boat one (similar) where the water goes WELL over the porthole scares the everloving shit out of me every time,anxious
You're trying to send your 15yo sister and her Bf to jail because she annoys you? Tell your parents you need therapy.,calm
What about from the POTUS?,calm
"I didn't delete it. Your moderators did. But that's what someone do, they",frustrated
"Sorry, What I meant to say was if it had been worded differently it wouldn't have the same effect.",tired
Ive missed this kind of rant. Thank you. Thank you so much.,grateful
Until that plant dies because you just shocked the hell out of its root system.,angry
someone’ ego has turned him into such a bully. He seems to get off lately on witch-hunting and encouraging his “sisters” to harass people.,frustrated
It's harder to find a decent picture of him,lonely
Omg its hannibal cooper,calm
Yep completely bc no kids ever liked to draw. Definitely me.,angry
"Every time I see a something like, 'thanks for nothing, someone,' I mentally apologize to her, lol.",lonely
Cos Disneyland is too damn expensive for them these days.,calm
Perfect example of the disgusting misuse of ‘Orwellian’ on this website,angry
"Doesnt matter where it happened, retail companys will find any excuse to throw their employies under the bus",tired
"The few people that survive jumping from bridges say, almost invariably, that they regretted jumping the second they entered free fall.",tired
What's the name of the artist that featured him? Can't remember it,calm
tfw you were part of the comment chain but doesn't get to be in the meme. *INSADTINENS*,calm
Wish they would of given air vehicles some love. A lot of ace pilots hated the game.,excited
I may be mistaken but I believe it’s illegal to fly over the north and south poles for any aviator,angry
The concern is that there is a very high likelihood of his health deteriorating in one way or another before he can complete two full terms.,tired
Gotta wonder how a fake BC could possibly result from a 'mixup'.,excited
Oh I’m sorry. I assumed. I think that would be suspicious if your username was known to someone else.,tired
Yeah... but did you know he was undrafted out of Minnesota State?,calm
Actually you're a someone if you aren't for exterminating the 'wrong inherently evil and guilty race'.,angry
every time you see the snake edge and still get hit even though you *swear* you were holding downback,lonely
Sorry pal but your just England’s b team,tired
">If you were to confiscate $900 billion of someone assets, lmao",happy
"Actually, I was just wanting for him to say...""oh know...just attack her...""",calm
I wonder if the paintings he did on Brooklyn 99 were actually his.,excited
*pat pat* they will all be fine,happy
"And just to continue the tradition, they reported on building 7 falling 25 minutes before it fell...",frustrated
You don’t understand the design of our government.,frustrated
It’s something put aside in case I really screw up and have no other option but return home,angry
He doesn't know who leaked it. The guy filming it isn't the same guy that leaked it.,sad
"""Wildlife Safari is excited to offer paintings made by the elephants living right here in Southern Oregon!""",excited
"Important part of this, surprising it's not there.",excited
why wont i just fucking die,angry
back then at school there was a girl in my class who probably had social anxiety too but i never said anything to her...,sad
This is dangerous.,anxious
"Sorry, didnt realize. Anyway an r/woooosh so...",tired
"Which is odd, he was terrible on Sunday",anxious
"Need those thick strong legs to give the boot to all inferior and lesser beings, keep them firmly on the ground while you stand tall over them!",grateful
oh god this is the worst,lonely
Then YOU go right ahead...support and guide him.,calm
Yea but you seem to forget how bad we were last year. Worst year in the franchise history.,angry
"And my apologies if I misinterpreted but you seemed to state multiple times that it keeps you from seeking other women, such as the someone example.",tired
That chick at the end. She just gets sucked onto the floor by pure sexual magnetism. 😂,calm
"No. Hell no. It's ""anxiety"". When needed for medical notes and such my doctor will also write anxiety.",anxious
just awful I'm gonna throw a barbeque to get back at them,tired
Lucky for you. I haven't been able to watch Oneyplays since someone and someone left. It's just not the same.,grateful
Thank you brother. I saw you once!,grateful
This sub needs more Poison memes.,excited
I tried Nair once. Do not use Nair.,sad
The best for a reason.,calm
>Parkour is better in odyssey Hah. Nice one. I was actually believing that this was a serious post up until that point.,calm
"Doesn’t a disaster declaration at the federal level, which is a condition of FEMA funds, require the president to sign off?",calm
She had it saved on her phone because she was too lazy to delete it. Thank goodness.,angry
who doesn’t know what an Ethernet port looks like lmao,excited
! remind me 2 days,calm
"Uhhhhh...it ain't cheaper than upstate especially the Syracuse, Rochester, and Buffalo area. It's much more expensive.",excited
but this has been going on for months,lonely
You didn't need to split this into two posts...,angry
Are you my coworker? I swear my boss will randomly scream and its embarrassing.,lonely
Win what exactly? A meaningless game in a very long season to be swept out of the playoffs? No thanks.,angry
Fuck her. I hate her so much. I wish she’s just vanish back to Indonesia with her mustache.,angry
"It was not my ex, I just watched her in action.",frustrated
"Of course man, I really appreciate this. But it's okay, I can just message you through here. It's fine:)",grateful
HOW DID I NOT THINK OF THIS,frustrated
The concern is that there is a very high likelihood of his health deteriorating in one way or another before he can complete two full terms.,sad
I dont know.. i did message him many times but he didnt reply me.. i am worried about him. I asked his mother about him,anxious
We are not Barcelona or PSG we have structured wages.,frustrated
At least he didn't throw them at someone.,happy
I like this new trend,excited
It's a song reference. The lyrics were awkward so one of my FB friends made a meme,angry
