text,emotion
Nobody wants to fight the naked guy.,anxious
I was/am the same. I'm the one pushing forward with the divorce though. The feelings of loss and fear are overwhelming sometimes though.,anxious
Yepp. I've struggled to hold a job so I'd be in trouble without it.,anxious
"dude, your mom is a fuck-nugget, i’m so sorry you’re dealing with this",tired
In a CNBC interview he said due to the current events he identifies as an independent.,calm
someone type awkwardness that some thots go nuts for.,angry
#1 rule you don’t say it you can think it but never say it,calm
"A ""kicky switch""? I'm not sure where to use that, but I'll find a way.",excited
I adore this. It gave me so many chills of happiness!,happy
He looks especially cute in the glasses.,grateful
"not really. I worked hard to live there, and it was different then. Far cheaper.",frustrated
"True, I misread the post and thought it was applying it to on-field performance. My apologies.",tired
"If the answer is No, the kid dies. If the answer is yes, the kid also dies",calm
Or you could literally walk down amy street and see any ugly guy with a girl..,calm
I'm still so sad we never got to see someone witnessing his miracle baby's first steps. ☹️,sad
"Wow, this is my trashy goals in life. This woman is living out my dreams.",excited
Silence and For Greater Glory,grateful
This is one of the worst written posts I've seen on this sub for a while,frustrated
account got suspended lmao,happy
Wooah :o Didn't know someone had a son xD,excited
"Completely correct. But he Might have lost control, blown a tire, etc., or maybe just panicked human error.",anxious
It’s crazy that people know this and yet rake someone over the coals for not wanting to talk to someone.,excited
I'll give you that. Society is generally in a decline. I don't date men so I can't speak to that.,sad
Very true. Apologies if it came off that way.,sad
That awkward moment wHen someone already used shell as a pun earlier,lonely
That awkward moment when people who passionately hate someone inadvertently portray him as a hero.,lonely
What if someone just tricked everyone to make us appreciate the coach we had all along...,happy
Why the social anxiety? You are going on an adventure with friends and are excited not anxious,lonely
Humiliation on top of arrest!!!,lonely
if you need to ask here with all due respect your the last person that should be on it.,frustrated
Is that why I didn't like the show? Am I too happy?,happy
"If anything makes me belive someone DOESN'T get laid, it's comments like this.",excited
She needs help but she will probably just get jail and release and just never get better because that's how things I'm this country work,calm
Damn. Low tech bait bike,angry
So much confetti,calm
Wow someone has a lot more insecurities than I thought,excited
Optimism and emotions got us into this mess in the first place ffs. At least clarify why you are optimistic.,happy
"Just a reminder that back in 1918, the Republicans were still the liberal party, and the someone were the racists.",grateful
"Yeah, but that driver's mistake could have easily seriously harmed or even killed the pedestrian, this is not a ""we all make mistakes"" situation.",angry
Lol there you go. Forgot to switch back from your alt for a second there.,calm
Thats pitty indeed,tired
"someone, your uncle is not the hero you think he is.",frustrated
"Mine is when my husband says our daughter’s emphysema is acting up. No, husband. Her eczema is.",frustrated
My husband and I have been circling the drain for years. :(,sad
dang... that's just crazy.,happy
">Also, you realize that both parties largely dabble in identity politics. Oh absolutely! It's a major reason I hate someone.",angry
it’s starting to get weird,lonely
i managed to craft that super early in the game and i was so disappointed that i basically could not get drunk,sad
Except you didn't and it's still false.,frustrated
The age of consent is 16. It's the indecent nature of the photo that has gotten him in trouble.,lonely
Have fun getting arrested for child porn then! Check your DM’s 😉,happy
Mother of someone... Im not grossed out very easily. I can stomach just about anything. But this made my fucking skin crawl....,angry
someone I’m so sorry sweety,tired
And the purse tacos!! Need that midday snack!,excited
I think I met you. Sorry if I was a bit standoffish.,tired
“stay still” the best and most timely advice you’ll ever get.,calm
No. Can’t get off to my own sex.,sad
There are two kinds of people in this world. Those who extrapolate from incomplete data.,calm
im driving and i cant stop screaming i need to talk to someone in sorry,angry
"Wow, that's cool!",excited
Seriously. I wonder if OP has seen some of the amazingly stupid faces that someone and someone make.,excited
Be honest with her... or put her on a pedestal just high enough to see up her dress... ;),grateful
That is even worse. No tax from them and we provide them with services.,angry
Spurs gonna get two in a row over us. Embarrassing,lonely
Well now I am super pumped! someone I hope AA doesn’t disappoint us,happy
Imagine if we were that team that was just 1 piece away instead of the team that is 14. 😭,calm
"One time, she punched me in the face. It was AWESOME.",happy
"No, he's told me on multiple occasions he hates anime",frustrated
> 420 blaze it!! wasn't that the red sox payroll doe? they got their ring.....,calm
I'm sorry for you... That sounds not cool :'(,sad
You are so right. Reddit response of reading only the first few words. It's been a long damn week. My apologies.,tired
"And there you have it, the left who argue with personal attacks and cnn buzzwords.",angry
Where do you plan to go?,calm
holy crap that's messed up.,happy
"Enthusiasm is not helpful, got it. Edit: lol what a bunch of snowflakes.",happy
"Shut the fuck up, loser.",angry
"Spending my first day ever in Europe. In Oslo, with an amazing girl I met visiting Texas from Norway about a year ago.",calm
"A Canadian Breakfast for €0?!? Unbelievable, what a world we live in.",excited
"Blame [RELIGION] communities where it's normalised for men to divorce women without giving her any of her rights , even Islamically.",sad
Aww man. And I just came up with a great shitpost I mean idea....,excited
"Also, keep an eye out for women who just want to use you for free drinks!",calm
Rahway Mechanical LLC should be able to. Great guy,grateful
I’m sorry I only have orange ones :(,tired
I didn’t know someone disliked Pittsburgh so much,excited
Oh sweet I get someone powers,happy
Please stop using that term.,frustrated
TV shows. And occasionally movies. I stopped Interstellar at that stupid love speech. Never finished it.,grateful
Yeah this is what im currently witnessing with my nephew and nieces. I wish i can do something about it.,tired
I’m offended that your offended,sad
That poor kid. That is going to cause some issues for them as well down the road.,sad
I am glad your okay.,happy
It’s been over 20 years since I rode the 15. I’m still traumatized.,anxious
You spend most of your time here in the Rangers threads talking about how much you hate the huns. That's pretty weird as well.,tired
I did this once with a chimichanga. I was 11 and I cried,sad
That number seems a bit low to me,frustrated
She looks dead on the inside in the photoshopped pic,tired
I picked up smoking again thinking it would aid that void that is working. It just made it worse.,angry
"Nope, not really",frustrated
"35-55 a week. no health restrictions, just eat what I feel like",calm
why does he look like someone,lonely
And KAT with 6. Weird game.,lonely
Ok that was a rude way to send him off. Can I have hot doctors again,lonely
May someone bless and keep the President... far away from us!,grateful
That's pretty bad though would certainly explain things.,tired
I get scared just reading your flair,anxious
I’m so nervous!,anxious
"Yeah he was going like ""YOOOO"" and his boy was like yo chill man tf this aint no club keep yo voice down lmao",happy
"Woah, dude. That's some research! You should totally make video essays and earn some bucks on YouTube.",grateful
"I felt it once, then I quickly realised I was horribly mistaken when someone better came. There's no such a thing as ""the one""",tired
Thanks man! This was great. :-),grateful
So cynical! 🙄 😂,anxious
Yeah I think you understood my issue then,anxious
I didn't have an umbrella and got wet but it's so damn humid still it's all stanky feeling outside.,angry
"Do you have any non anecdotal stuff to say or? Also burden of proof is a thing, you made a claim, prove it or fuck off",angry
"And if they can't find US suckers to give them cheap labor with desired skills, they'll simply replace you with an imported indentured laborer from India.",angry
"Am I tripping or something? This sounded clearly fake to me, I remember hearing the someone one, which also sounded fake but not as much.",sad
"I gotcha, I knew you guys have still played some bball games, but I just figured your rivals were mainly Fresno State and Nevada.",calm
Making my bold prediction now. someone finishes #1 RB in 1/2 PPR for 2019.,happy
Honestly I’d believe it. someone seems stuck in that high school mentality,calm
Our federal budget is $4 trillion. Until entitlements are reformed the arguments over what things cost is irrelevant.,angry
I'm afraid of having a sit down with them amd not being heard. But I might have to for my safety.,anxious
Oh for fuck’s sake.,anxious
"He’s one of those players that you would love if he was on your team, but hate if you have to play against him.",grateful
You literally changed someone's life for the better. You made the world a better place. Thank you for helping change the stigma against autism.,grateful
My someone accuses me of cheating all the time too when I’ve been nothing but loyal. Makes me wonder if she was cheating on me too...,anxious
I lowkey hope I'd find this in the comments somewhere Was not disappointed,sad
Been getting this same feeling these days.. idk what it is I just have no drive anymore maybe once the cwl comes back it’ll help,anxious
nice one! but it‘s a much more underground one I think,grateful
I'm trying to understand the cat shirt.,happy
I'm in the hospital right now. Should be getting released later today,excited
Based on the down votes I can say this is truly an unpopular opinion although it shouldn't be,frustrated
This looks amazing. I'm sure Netflix will cancel the series in February.,excited
"Translation: ""I have no argument so here's a rude comment"".",angry
"Thought about that too, guess it's just not the games intention to make the player a part of the things happening in it...",excited
Sounds pretty optimistic... I'll believe it when I see it!,grateful
So in other words you don’t have one? So much for attempting to be on the same page.,anxious
Oh my someone that's so awkward,lonely
Oh hey that's pretty cool!,calm
I'm sorry to tell you this but your mate probably touches children too. That's the only logical conclusion I can come to here.,calm
"I don't do the things you mentioned above, I just draw shit ^all ^^sfw ^^^ofc But hey, thanks for that ;-)",frustrated
someone I want to get that ~~monkey~~blackhawk off our back so bad.,excited
That entire family is so embarrassing.,lonely
Wow i've sat like all of those,happy
Apple can still go kindly fuck itself tho,angry
they're shite - disgruntled OCSC fan,angry
"They seem to have very ""sick"" laws in Saudi Arabia. Where women don't have any protection from government against their perpetrators.",angry
Same reaction I had last week when I learned that someone was once engaged to someone.,excited
No scratch. Weird. It's almost like she just popped her pimples and smeared the blood. 🤔,lonely
Inspiring music that makes you proud.,happy
Hello autism my old friend,grateful
It would be terrible if he died and they put his head in a jar or something,sad
"That’s why I called them Turd Gen, haha. Getting a High Country/Denali with the 6.2 to replace it.",happy
"Sorry guys, I went a little far... You can read my apology post here.",tired
I also relate (and regret),tired
"someone for sure!.. just make sure you DO NOT get a new addidas one, get an old authentic one from the time frame he played",frustrated
Sorry to be the bearer of bad news,tired
Yeah it sort of sucks now.,sad
Its just a prank bro.,happy
Omg TDG has a new singer? That's so sad. I was rocking out to them in middle school too. Simpler times.,sad
The fuck?! You're in the wrong subreddit with this regressive bullshit victim blaming.,angry
"I’m surprised nyxl hasn’t done that with their overloaded dps roster, but a possible upcoming import limit might be the issue",excited
Wowowowow!!!! I’ve been campaigning for someone too!,excited
"Same, but someone is one of my favorite champs, so beong useless hit me extra hard.",angry
Fucking refs suck my balls.,angry
Something extremely fishy is going on here with this story.,anxious
This isn't so bad. The fact that the buttons only go up halfway doesn't bug me at all. At. All...,sad
I'm thinking I'd be wondering how I got my hands on a time machine.,excited
"Got a bit tipsy in my room alone, dancing in my underwear to some cheesy music for the whole night, and then cried myself to sleep",sad
I live in Wyoming and I had WiFi once,calm
Denigrating your opponents as either racist xenophobes or labelling them too stupid to understand the issue at hand will have that effect.,tired
youre a disgusting piece of filth.,angry
someone I hate this,angry
"I don't know why he'd take it like that, he was gone for so long so someone was going to do a show like that.",frustrated
Champaign’s a weird town in that aspect..,anxious
I really want to know what the coordinates he gave him are,excited
someone has progressed so much this season. Took him a little bit to start getting his confidence but I’m a lot more excited about his future now,excited
"If anyone believes this post, they are more of an idiot that the op",calm
I would never stay at a hotel that had people ringing a bell at the bar nonstop. Not to mention the gong,angry
"Uh oh. Ummm, I need to take care of something.",grateful
Honestly I don't care if they're faked. It's an original concept that I find pretty funny,happy
I wish she wouldn’t choose someone she can do better but we all know she will,excited
Looks like she's saying that just to be nice imo,grateful
"Im sorry but I dont get the joke, can someone explain it to me?",lonely
"Sorry bucko r/necrophilia got taken down, I think your in the wrong place buddy. Here I’ll call you an Uber, take care of yourself.",grateful
I'm literally screaming.,sad
"yuck, I'd be embarrassed to walk around with a black belt if I were actually blue-ish",lonely
"I just hate the ""I don't know"" people",angry
This made me sad,sad
You seem horrible,anxious
"It was intentional. Maybe not with much thought behind it, but a very dangerous instinct.",anxious
Good luck my tw broskies :(,grateful
He is like a bad cartoon that’s hard to turn off.,anxious
Sorry man. I didn’t know you were on reddit. Didn’t mean to steal your stuff! I totally would have tagged you,tired
I went to the exhibit in Chicago some years ago. It’s absolutely stunning,grateful
I just discovered her today and I love her music,happy
Dude. There should be like...underpants with a huge pouch for your balls then. When you age those guys get so saggy.,lonely
This grammar is horrible. Discovering something is a fixed single point in history which should have been simple past “was” instead of “had been.”,anxious
I'll be surprised if *Monty Python's Life of Brian* wasn't one of those.,excited
because the cops dont have the manpower to chase after every schmuck who orders small amounts...,angry
I'm sorry that happened. Was her hospice nurse aware that she was suffering?,tired
"Sorry, I swapped back to Canada unclearly, to respond to the comments about it.",tired
Oh fuck I almost forgot to jerk off and smoke weed today. I'm so forgetful. Appreciate the reminder.,lonely
"hmm... we don't need someone now, we need ball retention",anxious
I don't think a player can have no value and also be worth rioting over if he's traded.,frustrated
Thanks for giving advice to the people who need it 👌🙏,grateful
I feel sorry for this little girl. She's legitimely scared.,tired
"As long as someone isn’t a judge again, we can be optimistic",happy
Just to tax a bit of the smug out of them would be worth it in itself.,happy
Professionally.... no way I could do that to myself,frustrated
I just had deja vu reading this comment. Weird.,anxious
Uh . . . Uh . . . I'm not feeling so well.,anxious
"I am just saying in general, in any situation. Work or not.",calm
Aww that's so sweet !,excited
ISN'T YOUR CLUB RUN BY A JABBA-THE-HUT-LOOKING DONALD-TRUMP-ACTING MORON WITH A ~~FIVE SIX SEVEN TEN~~ FIFTEEN YEAR PLAN?,excited
I frequently have issues with these large temperature swing but it has to due with allergy pollen activation.,lonely
"Collusion! Nah but seriously, Knicks need to fall back.",tired
"Not sure about OP, but caffeine tends to make many people more anxious (especially those with a co-morbid anxiety disorder(s)).",anxious
"I know, right? What an embarrassment that local news would call that thing a ""tractor"".",lonely
I legitimately had a hard time believing such terrible people exist until I encountered one for myself!,sad
">However, we're leaving waswas and inmoral behaviour with it! Amin and amin.",frustrated
He’s just paying lip service to the idea to secure support from people who think he’s pro-EU,calm
I love flying out of Midway because I feel like I have never waited more than 10 minutes for security. I love the lines at Midway.,happy
If New Jersey are going to win it in the winter they better get something done quickly..,calm
"Yeah , yeah you can’t change my mind , you’ll get there eventually .",frustrated
"He closed the stream with a song of hers, while hugging his skele-buddy. It was a good song.",grateful
I'm glad you managed to find your own fun and most probably made a big contribution for this great ending. The whole masked rogue idea was amazing,grateful
"Tranlated: Wooooo be afraid of the spooky ""shadowban"" so don't do the thing that gets your message to a wider audience. Smh",frustrated
"Where is you fur, human? You're a disgrace for all young generations",lonely
"I want to know them - so I can actually murder them. (With words, that is.)",angry
someone just make one shot and we’ll be happy,happy
Then much of the advice here is terrible because it congratulates him on doing the entirely wrong thing.,anxious
"Too late, you read it anyways. Ban me if you don't want to read more. Lmao!!",happy
"I've pulled a long, curly black hair out of my mouth while eating a meal once... I'm a man with very short blonde hair. 🤢",lonely
I started the Kitty City Meowboys and I do those things. I have a mic but I don't use it because talking exhausts me,frustrated
Full schedules have been The end for us before but This time I have hope,happy
Disney World/Land or NYE at Time's Square have always made me nervous.,anxious
I don't know how long I should wait or if its even a good idea. Im so co nfused,grateful
"No you don't, you love lies and liars.",angry
Range should be maxed,calm
I would absolutely hate it if they used it in the games tbh,frustrated
"Welcome to the future, kid. Unfortunately your mom isn't coming.",grateful
I do that too. I just feel oddly uncomfortable when I'm doing a task and there's no noise in the background.,lonely
im surprised you didnt try to go over her head to the owner or did he just not care about what the new GM was doing?,excited
"Well, yeah, it's a climate target. Climate targets are made for missing.",sad
You’re using the failing of someone else as an excuse to make the same mistake yourself,angry
"That's true, and I love pitbulls, but a poorly-trained Chihuahua isn't going to rip your face off, nor are they naturally disposed to aggression.",happy
I think its safe to assume that we're clearly referring to the article and topic at hand.,calm
"No it's because we're ugly, short, and ethnic",sad
"No, I have to make money somehow, I’m not doing more than Mom dies of polio before getting in a relationship,",frustrated
Thank someone for the disclaimer you almost tricked me justin,happy
You just blew my mind. Why haven't I thought of that before. You think someone would have explored that far east.,excited
You can't talk morality to psychopaths.,calm
"Such a shame. Her butt was pert, cute and perfect in her Vogue days. Yes, I am showing my age.",lonely
"I’m sorry you’re going through the hurt, this shit sucks so bad.. I don’t wish this upon anyone..",tired
You sick fuck it has heads and arms we can’t eat that.,angry
No I know they're on xbox. I just added that last part as a poor attempt to be funny.,frustrated
"Yes dumbest person on all of Reddit, please make a youtube channel for all of us to laugh at.",happy
That’s not how totaling works.,frustrated
And when I thought this sub was gee AF someone says the day with this gold nugget,angry
This show would suck without him. It would just be the same old someone bullies someone bs it usually is,grateful
Ok cool but where can you study Old Norse? That seems like exactly the type of useless but cool skill I’d love to have.,happy
"She broke that young man's toes, ankles, and knees on that fall. lol",happy
"Oh, sorry bud. Didnt mean to be rude",tired
This is truly terrifying.,anxious
I was so sure that was someone,calm
Oh wow. That’s nice of New York.,grateful
A guy tried to do this in France after the French Revolution. Did not go well.,frustrated
Double barrel Pink eye. Awesome.,grateful
It was less painful than a bee sting! I felt so silly afterwards!,lonely
dear... husband,excited
"Yep California, I would've been surprised if they cleared him.",sad
"She had really bad chronic back pain from what I can remember, so was self treating with alcohol",calm
I feel like someone isn't a legend.,frustrated
No one comes here it’s cool,happy
Sorry. I read that as newly white and it cracked me up.,tired
Wow are you saying political agitators will drum up a controlled crisis and disseminate the edited video through a foreign fake twitter account,excited
"Only when they have dirt underneath them, now that’s disgusting.",angry
Actually you're a someone if you aren't for exterminating the 'wrong inherently evil and guilty race'.,frustrated
Wow I’m sorry. Can you take pictures of your bruises? What was she nagging you about?,tired
The fact that LGBTQ rights were only recently (and not completely) recognized by the government directly contradicts the idea that gaining their rights has been quick.,calm
This is how far the Broncos have fallen. They no longer command the best and the brightest. Now it's .500 retreads. This should be concerning.,sad
Then present an opposing argument.,calm
*Googles what is the third leading cause of death* Google *updated*: Measles causes by stupid people not vaccinating their children,sad
I’ve made candies almonds and cashews in a slow cooker before. They’re surprisingly not mushy or soggy.,excited
someone face be like: “When you wish you stayed home instead of being embarrassed in front of 100+ million people...”,lonely
I agree. That should be the core. someone will be an elite defender,calm
Ps mad love seeing that the block has a baestok bighead,calm
Because all those delusional people be doing the same shit in their real life.,lonely
Whaaaaaaat the heck was that?,excited
My life is complete,sad
Yup. I’m assuming cause it’s live crawfish and early in the season? Idk. I love crawfish cafe but not for that price.,happy
"Thanks for pointing them out, it's hard to see through my tears 😢",grateful
That's no excuse.,angry
Oh poor guy. That’s so sad. I can see why she is an ex friend.,sad
tl; dr you can just bore them to death.,angry
I like this feeling,grateful
"Nice rifle. I have a T3 in 7mm rem mag. N Mine would suck as a SHTF rifle, but it's great for hunting.",grateful
So sorry you are hurting.,tired
Another episode of idiots with guns,frustrated
"Yes, we do. One with very misguided priorities",lonely
THEY ARE SO CUTE TOGETHER!!,happy
oppressed by nature!,sad
Going to bed early never works for me. Sleeping in is the only way I feel rested.,calm
Maybe the dog wasn't on a leash the last time...,happy
"Well, that was dumb.",angry
"Weird! Also in Winnipeg, no issues. Do you have a VPN?",angry
I bet he doesn’t line up for Daniels Donuts,anxious
Want too big and lean to be naturally achievable.,grateful
I'm moving to the UK in 2 weeks. This terrifies me.,anxious
Not threatening? It is an exhortation to commit a violent sexual act against a woman.,anxious
Yes. (That's the back side of the Palace hotel.),calm
I have but I sugar discreetly and I’m genuinely afraid to have that compromised due to the field I’m in,anxious
They were my favorites. Players apparently hated them though.,sad
I scrolled past this and thought this was a title reveal and got so excited. Good GOOD theory though!,excited
"You're right, but you forgot to mention they are registered someone",calm
Right? just like the shock I had in elementary school when I learned the KKK was started by someone,excited
"If you are really so dead set against shoveling sidewalks, perhaps you should move to a warmer climate.",anxious
"Wow it looks like we held our own negotiating here, nice to see.",happy
Who's to say she'll pay for funerals? Why not just dig a mass grave and call it a day?,calm
Unfortunately if they tried to parent they’d never listen or just hate them and run away. Pointless,calm
"It's not about fixing anything, it's about making the wicked suffer.",sad
Gl hf team we can do this! :someone: Whole team leaves,anxious
